{
  "schema": "wellm.version-registry/v1",
  "package": {
    "name": "wellm",
    "version": "0.2.0rc4"
  },
  "protocols": [
    {
      "id": "wellmanifest.protocol/v1",
      "version": "1.0.0",
      "compatibility": "backward-compatible-within-v1"
    },
    {
      "id": "wellmanifest-ir/v1",
      "version": "1.0.0",
      "compatibility": "exact-major"
    },
    {
      "id": "wellm-governance-profile@1",
      "version": "1.0.0",
      "compatibility": "exact-major"
    },
    {
      "id": "wellm.type-module/v1",
      "version": "1.0.0",
      "compatibility": "exact-major"
    },
    {
      "id": "wellm.version-registry/v1",
      "version": "1.0.0",
      "compatibility": "exact-major"
    },
    {
      "id": "wellm.env-contract/v1",
      "version": "1.0.0",
      "compatibility": "exact-major"
    },
    {
      "id": "wellm.intent-format-project/v1",
      "version": "1.0.0",
      "compatibility": "exact-major"
    },
    {
      "id": "wellm.intent-format-analysis/v1",
      "version": "1.0.0",
      "compatibility": "exact-major"
    },
    {
      "id": "wellm.todo2code-format-evidence/v1",
      "version": "1.0.0",
      "compatibility": "exact-major"
    },
    {
      "id": "wellm.iot-telemetry/v1",
      "version": "1.0.0",
      "compatibility": "exact-major"
    },
    {
      "id": "wellm.iot-device-config/v1",
      "version": "1.0.0",
      "compatibility": "exact-major"
    }
  ],
  "standards": [
    {
      "id": "json@rfc8259",
      "version": "RFC 8259"
    },
    {
      "id": "yaml@1.2",
      "version": "1.2.2"
    },
    {
      "id": "json-schema@2020-12",
      "version": "2020-12"
    },
    {
      "id": "hcl@2",
      "version": "2"
    },
    {
      "id": "proto3",
      "version": "proto3"
    },
    {
      "id": "toon@1",
      "version": "1"
    },
    {
      "id": "mqtt",
      "version": "5.0"
    },
    {
      "id": "grpc",
      "version": "1"
    },
    {
      "id": "asyncapi",
      "version": "3.0.0"
    }
  ],
  "apis": [
    {
      "id": "wellm-http-api",
      "version": "v1",
      "transport": "http",
      "basePath": "/v1",
      "contract": "openapi@3.1",
      "schemaPath": "schemas/openapi.json",
      "sha256": "sha256:49f4e839bb3dde01d0e18e4c4425aeb9f00c2945236bed391dfeb3e91f2e7341"
    },
    {
      "id": "wellm-websocket-api",
      "version": "v1",
      "transport": "websocket",
      "basePath": "/v1/ws",
      "contract": "asyncapi@3.0.0",
      "schemaPath": "schemas/asyncapi.yaml",
      "sha256": "sha256:c52df2ba28bc2d956fd047a2198330ac1ebf1a8b2dffa80cc842be2b0d60294d"
    },
    {
      "id": "wellm-mqtt-api",
      "version": "v1",
      "transport": "mqtt-v5",
      "basePath": "wellmanifest/v1/{tenant}",
      "contract": "asyncapi@3.0.0",
      "schemaPath": "schemas/asyncapi.yaml",
      "sha256": "sha256:c52df2ba28bc2d956fd047a2198330ac1ebf1a8b2dffa80cc842be2b0d60294d"
    },
    {
      "id": "wellm-grpc-api",
      "version": "v1",
      "transport": "grpc",
      "basePath": "wellmanifest.v1.RuntimeService",
      "contract": "proto3",
      "schemaPath": "proto/wellmanifest/v1/wellmanifest.proto",
      "sha256": "sha256:12491ef0767cda5517214b8acab5b42a3206690731abd08189d6eaafd439650b"
    }
  ],
  "dialects": [
    {
      "id": "hcl@2",
      "family": "hcl",
      "version": "2",
      "status": "stable",
      "documentKind": "data",
      "mediaTypes": [
        "application/hcl",
        "application/wellmanifest+hcl"
      ],
      "extensions": [
        ".hcl",
        ".tf",
        ".wm.hcl"
      ]
    },
    {
      "id": "json@rfc8259",
      "family": "json",
      "version": "rfc8259",
      "status": "stable",
      "documentKind": "data",
      "mediaTypes": [
        "application/json",
        "application/wellmanifest+json"
      ],
      "extensions": [
        ".json",
        ".wm.json"
      ]
    },
    {
      "id": "policy-sh@1",
      "family": "policy-sh",
      "version": "1",
      "status": "candidate",
      "documentKind": "policy",
      "mediaTypes": [
        "application/wellmanifest+policy"
      ],
      "extensions": [
        ".policy",
        ".policy.dsl",
        ".dsl"
      ]
    },
    {
      "id": "proto3",
      "family": "proto3",
      "version": "unversioned",
      "status": "stable",
      "documentKind": "api",
      "mediaTypes": [
        "application/protobuf",
        "text/x-protobuf"
      ],
      "extensions": [
        ".proto"
      ]
    },
    {
      "id": "toml@1.0",
      "family": "toml",
      "version": "1.0",
      "status": "candidate",
      "documentKind": "data",
      "mediaTypes": [
        "application/toml"
      ],
      "extensions": [
        ".toml",
        ".wm.toml"
      ]
    },
    {
      "id": "toon@1",
      "family": "toon",
      "version": "1",
      "status": "candidate",
      "documentKind": "ir",
      "mediaTypes": [
        "text/toon",
        "application/toon+yaml",
        "application/vnd.code2llm.toon+yaml",
        "application/wellmanifest+toon"
      ],
      "extensions": [
        ".toon.yaml",
        ".toon.yml",
        ".toon"
      ]
    },
    {
      "id": "typed@1",
      "family": "typed",
      "version": "1",
      "status": "candidate",
      "documentKind": "data",
      "mediaTypes": [
        "application/wellmanifest+typed"
      ],
      "extensions": [
        ".wm",
        ".wellmanifest",
        ".typed"
      ]
    },
    {
      "id": "typescript@wellm-1",
      "family": "typescript",
      "version": "wellm-1",
      "status": "candidate",
      "documentKind": "data",
      "mediaTypes": [
        "application/typescript",
        "text/typescript",
        "application/wellmanifest+typescript"
      ],
      "extensions": [
        ".wm.ts",
        ".wellm.ts",
        ".manifest.ts"
      ]
    },
    {
      "id": "yaml@1.2/json-compatible",
      "family": "yaml",
      "version": "1.2/json-compatible",
      "status": "stable",
      "documentKind": "data",
      "mediaTypes": [
        "application/yaml",
        "application/x-yaml",
        "application/wellmanifest+yaml"
      ],
      "extensions": [
        ".yaml",
        ".yml",
        ".wm.yaml",
        ".wm.yml"
      ]
    }
  ],
  "formatProfiles": [
    {
      "id": "wellm-typed@1",
      "family": "typed",
      "mediaType": "application/wellmanifest+typed",
      "extension": ".wm",
      "canonical": true,
      "description": "Canonical authoring profile with inline type metadata."
    },
    {
      "id": "json-data@1",
      "family": "json",
      "mediaType": "application/json",
      "extension": ".json",
      "canonical": false,
      "description": "Readable JSON data preserving source object order."
    },
    {
      "id": "repo-json@1",
      "family": "json",
      "mediaType": "application/json",
      "extension": ".json",
      "canonical": true,
      "description": "Deterministic repository JSON ordered by schema and lexical dynamic keys."
    },
    {
      "id": "wire-json@1",
      "family": "json",
      "mediaType": "application/wellmanifest+json",
      "extension": ".json",
      "canonical": true,
      "description": "Compact deterministic JSON used for semantic digests and transport."
    },
    {
      "id": "yaml-json@1",
      "family": "yaml",
      "mediaType": "application/wellmanifest+yaml",
      "extension": ".yaml",
      "canonical": true,
      "description": "YAML 1.2 restricted to the JSON-compatible data model."
    },
    {
      "id": "hcl-static@1",
      "family": "hcl",
      "mediaType": "application/wellmanifest+hcl",
      "extension": ".hcl",
      "canonical": true,
      "description": "Static HCL-shaped data without evaluation-dependent expressions."
    },
    {
      "id": "typescript-data@1",
      "family": "typescript",
      "mediaType": "application/wellmanifest+typescript",
      "extension": ".wm.ts",
      "canonical": true,
      "description": "Restricted export-default TypeScript data module."
    },
    {
      "id": "toon-map@1",
      "family": "toon",
      "mediaType": "application/wellmanifest+toon",
      "extension": ".toon.yaml",
      "canonical": true,
      "description": "YAML-compatible compact code/project map with versioned producer metadata."
    },
    {
      "id": "policy-md@1",
      "family": "policy",
      "mediaType": "text/markdown",
      "extension": ".md",
      "canonical": true,
      "description": "Markdown with canonical dsl/policy/wellm-policy fenced blocks."
    }
  ],
  "schemas": [
    {
      "path": "schemas/artifact-metadata.schema.json",
      "id": "https://raw.githubusercontent.com/wellmanifest/wellm/v0.2.0rc4/schemas/artifact-metadata.schema.json",
      "contract": "wellm.artifact-metadata/v1",
      "version": "v1",
      "compatibility": "exact-major",
      "dialect": "json-schema@2020-12",
      "sha256": "sha256:c7954f6b4d870fa748cb30cbb4533caeb58153ba65042194e8035b6e2324cd1d"
    },
    {
      "path": "schemas/contract.schema.json",
      "id": "https://wellmanifest.org/schemas/contract.schema.json",
      "contract": "wellmanifest.contract/v1",
      "version": "v1",
      "compatibility": "exact-major",
      "dialect": "json-schema@2020-12",
      "sha256": "sha256:9c2394d589dd68943c23943b53d7bc79728c5936a54f2699095b60cbb2253a53"
    },
    {
      "path": "schemas/conversion-report.schema.json",
      "id": "https://raw.githubusercontent.com/wellmanifest/wellm/v0.2.0rc4/schemas/conversion-report.schema.json",
      "contract": "wellm.conversion-report/v1",
      "version": "v1",
      "compatibility": "exact-major",
      "dialect": "json-schema@2020-12",
      "sha256": "sha256:28cf58eb3c3becc5daa70cc4fbe35c3767907dd67e3cd884a28328a1901197fe"
    },
    {
      "path": "schemas/diagnostic.schema.json",
      "id": "https://wellmanifest.org/schemas/diagnostic.schema.json",
      "contract": "diagnostic.schema",
      "version": "0.2.0rc4",